card_id,carousel_id,slide,section,topic,hook,body,footer,source_id,voices,format
C133-FORMAT_A-S1,133,1,PRINCIPLE,SOCIAL ENVIRONMENT DESIGN,Your environment quietly decides how often confidence gets a chance to practice.,"If your week contains no natural social friction, dating will keep feeling like an isolated high-pressure event.",LOW PRESSURE / HIGH CALIBRATION,C133,"Vanessa Van Edwards, Nick Notas",format_a
C133-FORMAT_A-S2,133,2,COMMON MISTAKE,SOCIAL ENVIRONMENT DESIGN,Many men focus on confidence techniques while ignoring the structure of a life that rarely requires social use.,"Design a week that gives confidence somewhere to live, not just somewhere to be tested.",LOW PRESSURE / HIGH CALIBRATION,C133,"Vanessa Van Edwards, Nick Notas",format_a
C133-FORMAT_A-S3,133,3,REFRAME,SOCIAL ENVIRONMENT DESIGN,"Design a week that gives confidence somewhere to live, not just somewhere to be tested.","A recurring class, sport, club, or volunteer group creates better raw material for growth than waiting for ideal opportunities to appear.",LOW PRESSURE / HIGH CALIBRATION,C133,"Vanessa Van Edwards, Nick Notas",format_a
C133-FORMAT_A-S4,133,4,EXAMPLE,SOCIAL ENVIRONMENT DESIGN,"A recurring class, sport, club, or volunteer group creates better raw material for growth than waiting for ideal opportunities to appear.",Add one repeatable social environment before you ask dating to carry your whole confidence project.,LOW PRESSURE / HIGH CALIBRATION,C133,"Vanessa Van Edwards, Nick Notas",format_a
C133-FORMAT_A-S5,133,5,ACTION,SOCIAL ENVIRONMENT DESIGN,Add one repeatable social environment before you ask dating to carry your whole confidence project.,Your environment quietly decides how often confidence gets a chance to practice.,LOW PRESSURE / HIGH CALIBRATION,C133,"Vanessa Van Edwards, Nick Notas",format_a
