card_id,carousel_id,slide,section,topic,hook,body,footer,source_id,voices,format
C022-FORMAT_A-S1,022,1,PRINCIPLE,SOCIAL CONFIDENCE REPS,You do not need more motivation as much as you need a smaller starting line.,Confidence routines stick when they are light enough to repeat through mood swings and real life.,LOW PRESSURE / HIGH CALIBRATION,C022,"Logan Ury, Mark Manson",format_a
C022-FORMAT_A-S2,022,2,COMMON MISTAKE,SOCIAL CONFIDENCE REPS,Men make giant social plans after one surge of determination and then disappear when the energy fades.,"Consistency beats intensity because confidence is a conditioning process, not a pep talk.",LOW PRESSURE / HIGH CALIBRATION,C022,"Logan Ury, Mark Manson",format_a
C022-FORMAT_A-S3,022,3,REFRAME,SOCIAL CONFIDENCE REPS,"Consistency beats intensity because confidence is a conditioning process, not a pep talk.",A five-minute rule for starting one conversation is more durable than promising yourself you will become extroverted this month.,LOW PRESSURE / HIGH CALIBRATION,C022,"Logan Ury, Mark Manson",format_a
C022-FORMAT_A-S4,022,4,EXAMPLE,SOCIAL CONFIDENCE REPS,A five-minute rule for starting one conversation is more durable than promising yourself you will become extroverted this month.,Shrink every confidence goal until you can complete it even on a mediocre day.,LOW PRESSURE / HIGH CALIBRATION,C022,"Logan Ury, Mark Manson",format_a
C022-FORMAT_A-S5,022,5,ACTION,SOCIAL CONFIDENCE REPS,Shrink every confidence goal until you can complete it even on a mediocre day.,You do not need more motivation as much as you need a smaller starting line.,LOW PRESSURE / HIGH CALIBRATION,C022,"Logan Ury, Mark Manson",format_a
