card_id,carousel_id,slide,section,topic,hook,body,footer,source_id,voices,format
C070-FORMAT_A-S1,070,1,PRINCIPLE,DISCERNMENT AND COMPATIBILITY,The right person should not require you to become less yourself just to stay in range.,"Healthy fit usually asks for growth, not chronic self-erasure.",LOW PRESSURE / HIGH CALIBRATION,C070,"The School of Life, Mark Manson",format_a
C070-FORMAT_A-S2,070,2,COMMON MISTAKE,DISCERNMENT AND COMPATIBILITY,"When men are very attracted, they sometimes confuse adaptation with abandonment of core preferences and values.","Compromise is part of love; self-deletion is not. Healthy fit usually asks for growth, not chronic self-erasure.",LOW PRESSURE / HIGH CALIBRATION,C070,"The School of Life, Mark Manson",format_a
C070-FORMAT_A-S3,070,3,REFRAME,DISCERNMENT AND COMPATIBILITY,Compromise is part of love; self-deletion is not.,Making room for someone is healthy. Reshaping your personality to avoid disapproval is usually not.,LOW PRESSURE / HIGH CALIBRATION,C070,"The School of Life, Mark Manson",format_a
C070-FORMAT_A-S4,070,4,EXAMPLE,DISCERNMENT AND COMPATIBILITY,Making room for someone is healthy. Reshaping your personality to avoid disapproval is usually not.,Notice whether the connection invites expansion or ongoing self-editing.,LOW PRESSURE / HIGH CALIBRATION,C070,"The School of Life, Mark Manson",format_a
C070-FORMAT_A-S5,070,5,ACTION,DISCERNMENT AND COMPATIBILITY,Notice whether the connection invites expansion or ongoing self-editing.,The right person should not require you to become less yourself just to stay in range.,LOW PRESSURE / HIGH CALIBRATION,C070,"The School of Life, Mark Manson",format_a
