card_id,carousel_id,slide,section,topic,hook,body,footer,source_id,voices,format
C113-FORMAT_A-S1,113,1,PRINCIPLE,TRANSITIONING OFF APP,"A good move off the app feels like a natural next step, not a forced leap.",The transition works best when enough rapport exists to make the move feel earned but not delayed past usefulness.,LOW PRESSURE / HIGH CALIBRATION,C113,"Logan Ury, Bumble",format_a
C113-FORMAT_A-S2,113,2,COMMON MISTAKE,TRANSITIONING OFF APP,Some men either ask too soon out of impatience or wait too long out of fear.,Aim for the moment when the interaction already has momentum and a simple next step would clarify rather than disrupt it.,LOW PRESSURE / HIGH CALIBRATION,C113,"Logan Ury, Bumble",format_a
C113-FORMAT_A-S3,113,3,REFRAME,TRANSITIONING OFF APP,Aim for the moment when the interaction already has momentum and a simple next step would clarify rather than disrupt it.,A few lively exchanges with mutual curiosity are often enough reason to suggest texting or a date.,LOW PRESSURE / HIGH CALIBRATION,C113,"Logan Ury, Bumble",format_a
C113-FORMAT_A-S4,113,4,EXAMPLE,TRANSITIONING OFF APP,A few lively exchanges with mutual curiosity are often enough reason to suggest texting or a date.,Ask yourself whether the thread already has enough warmth to justify making it easier to continue.,LOW PRESSURE / HIGH CALIBRATION,C113,"Logan Ury, Bumble",format_a
C113-FORMAT_A-S5,113,5,ACTION,TRANSITIONING OFF APP,Ask yourself whether the thread already has enough warmth to justify making it easier to continue.,"A good move off the app feels like a natural next step, not a forced leap.",LOW PRESSURE / HIGH CALIBRATION,C113,"Logan Ury, Bumble",format_a
