card_id,carousel_id,slide,section,topic,hook,body,footer,source_id,voices,format
C071-FORMAT_A-S1,071,1,PRINCIPLE,DISCERNMENT AND COMPATIBILITY,A mismatch does not need a villain to still be a mismatch.,"You can respect someone and still conclude that the emotional, practical, or relational fit is weak.",LOW PRESSURE / HIGH CALIBRATION,C071,"Logan Ury, The School of Life",format_a
C071-FORMAT_A-S2,071,2,COMMON MISTAKE,DISCERNMENT AND COMPATIBILITY,Many men linger because they think leaving requires a dramatic offense rather than an honest recognition.,Lack of fit is sufficient information even when the person is kind and appealing in other ways.,LOW PRESSURE / HIGH CALIBRATION,C071,"Logan Ury, The School of Life",format_a
C071-FORMAT_A-S3,071,3,REFRAME,DISCERNMENT AND COMPATIBILITY,Lack of fit is sufficient information even when the person is kind and appealing in other ways.,"You may admire someone and still realize your pace, goals, or communication styles would make the relationship harder than it should be.",LOW PRESSURE / HIGH CALIBRATION,C071,"Logan Ury, The School of Life",format_a
C071-FORMAT_A-S4,071,4,EXAMPLE,DISCERNMENT AND COMPATIBILITY,"You may admire someone and still realize your pace, goals, or communication styles would make the relationship harder than it should be.",Practice ending things based on fit before resentment has to do the decision-making for you.,LOW PRESSURE / HIGH CALIBRATION,C071,"Logan Ury, The School of Life",format_a
C071-FORMAT_A-S5,071,5,ACTION,DISCERNMENT AND COMPATIBILITY,Practice ending things based on fit before resentment has to do the decision-making for you.,A mismatch does not need a villain to still be a mismatch.,LOW PRESSURE / HIGH CALIBRATION,C071,"Logan Ury, The School of Life",format_a
