card_id,carousel_id,slide,section,topic,hook,body,footer,source_id,voices,format
C056-FORMAT_A-S1,056,1,PRINCIPLE,BOUNDARIES AND SELF-RESPECT,Good boundaries reduce confusion for both people.,"When your limits are clearer, others can choose around them instead of guessing and testing.",LOW PRESSURE / HIGH CALIBRATION,C056,"Brene Brown, Gottman Institute",format_a
C056-FORMAT_A-S2,056,2,COMMON MISTAKE,BOUNDARIES AND SELF-RESPECT,Hinting at preferences often creates more friction than just saying the preference directly.,"Boundaries are part of honest communication, not a sign that the interaction became hostile.",LOW PRESSURE / HIGH CALIBRATION,C056,"Brene Brown, Gottman Institute",format_a
C056-FORMAT_A-S3,056,3,REFRAME,BOUNDARIES AND SELF-RESPECT,"Boundaries are part of honest communication, not a sign that the interaction became hostile.",Telling someone you prefer to plan ahead is more useful than hoping they will eventually infer it.,LOW PRESSURE / HIGH CALIBRATION,C056,"Brene Brown, Gottman Institute",format_a
C056-FORMAT_A-S4,056,4,EXAMPLE,BOUNDARIES AND SELF-RESPECT,Telling someone you prefer to plan ahead is more useful than hoping they will eventually infer it.,Replace one repeated hint with one direct sentence that says what works for you.,LOW PRESSURE / HIGH CALIBRATION,C056,"Brene Brown, Gottman Institute",format_a
C056-FORMAT_A-S5,056,5,ACTION,BOUNDARIES AND SELF-RESPECT,Replace one repeated hint with one direct sentence that says what works for you.,"Good boundaries reduce confusion for both people. When your limits are clearer, others can choose around them instead of guessing and testing.",LOW PRESSURE / HIGH CALIBRATION,C056,"Brene Brown, Gottman Institute",format_a
