card_id,carousel_id,slide,section,topic,hook,body,footer,source_id,voices,format
C076-FORMAT_A-S1,076,1,PRINCIPLE,CHEMISTRY AND PLAY,"If chemistry is missing, forcing it usually makes both people less attractive.","No amount of performance can replace a genuine lack of pull, ease, or mutual interest.",LOW PRESSURE / HIGH CALIBRATION,C076,"Bumble, Logan Ury",format_a
C076-FORMAT_A-S2,076,2,COMMON MISTAKE,CHEMISTRY AND PLAY,Some men keep escalating because they hope effort will produce the spark that reality did not offer.,Sometimes maturity means noticing that the fit is ordinary and letting ordinary be enough to move on.,LOW PRESSURE / HIGH CALIBRATION,C076,"Bumble, Logan Ury",format_a
C076-FORMAT_A-S3,076,3,REFRAME,CHEMISTRY AND PLAY,Sometimes maturity means noticing that the fit is ordinary and letting ordinary be enough to move on.,A respectful ending after a flat date is stronger than trying to rescue it with bigger gestures or more intensity.,LOW PRESSURE / HIGH CALIBRATION,C076,"Bumble, Logan Ury",format_a
C076-FORMAT_A-S4,076,4,EXAMPLE,CHEMISTRY AND PLAY,A respectful ending after a flat date is stronger than trying to rescue it with bigger gestures or more intensity.,"When the energy feels dead, honor the signal sooner instead of trying to argue it into life.",LOW PRESSURE / HIGH CALIBRATION,C076,"Bumble, Logan Ury",format_a
C076-FORMAT_A-S5,076,5,ACTION,CHEMISTRY AND PLAY,"When the energy feels dead, honor the signal sooner instead of trying to argue it into life.","If chemistry is missing, forcing it usually makes both people less attractive.",LOW PRESSURE / HIGH CALIBRATION,C076,"Bumble, Logan Ury",format_a
