card_id,carousel_id,slide,section,topic,hook,body,footer,source_id,voices,format
C054-FORMAT_A-S1,054,1,PRINCIPLE,BOUNDARIES AND SELF-RESPECT,You do not need a courtroom brief every time you say no.,Overexplaining often reveals guilt where a simple preference or limit would have been enough.,LOW PRESSURE / HIGH CALIBRATION,C054,"Psychology Today, Brene Brown",format_a
C054-FORMAT_A-S2,054,2,COMMON MISTAKE,BOUNDARIES AND SELF-RESPECT,Men who fear disappointing people often talk themselves out of their own boundaries while trying to sound reasonable.,A short no can still be respectful when the tone is steady and clear.,LOW PRESSURE / HIGH CALIBRATION,C054,"Psychology Today, Brene Brown",format_a
C054-FORMAT_A-S3,054,3,REFRAME,BOUNDARIES AND SELF-RESPECT,A short no can still be respectful when the tone is steady and clear.,Saying that a plan does not work for you is often cleaner than producing a long defense of why it does not.,LOW PRESSURE / HIGH CALIBRATION,C054,"Psychology Today, Brene Brown",format_a
C054-FORMAT_A-S4,054,4,EXAMPLE,BOUNDARIES AND SELF-RESPECT,Saying that a plan does not work for you is often cleaner than producing a long defense of why it does not.,Practice one firm no this week without padding it with unnecessary apology language.,LOW PRESSURE / HIGH CALIBRATION,C054,"Psychology Today, Brene Brown",format_a
C054-FORMAT_A-S5,054,5,ACTION,BOUNDARIES AND SELF-RESPECT,Practice one firm no this week without padding it with unnecessary apology language.,You do not need a courtroom brief every time you say no.,LOW PRESSURE / HIGH CALIBRATION,C054,"Psychology Today, Brene Brown",format_a
